<?xml version="1.0"?>
<dataDocument xmlns:xsi="http://www.w3.org/2001/XMLSchema-instance" xsi:schemaLocation="../example-12/example-12.xsd example-12.xsd">
    <engineType>
        <fuelDetail>
            <combustible>Petrol</combustible>
        </fuelDetail>
        <fuelDetail>
            <combustible>Diesel</combustible>
        </fuelDetail>
        <capacityDetail>
            <capacity>Gallon</capacity>
        </capacityDetail>
        <capacityDetail>
            <capacity>Gallon</capacity>
        </capacityDetail>
    </engineType>
</dataDocument>